<?xml version="1.0" encoding="UTF-8" standalone="yes"?>
<configuration xmlns="http://footprint.dev.java.net/generated/config"
	xmlns:xsi="http://www.w3.org/2001/XMLSchema-instance"
	xsi:schemaLocation="https://raw.github.com/cejug/footprint/master/footprint-core https://raw.github.com/cejug/footprint/master/footprint-core/src/main/resources/schema/config.xsd"
	version="1" title="demo" idiom="en-US" date="2007-05-27">
	<template pdf.template.filename='template.demo.pdf'
		pdf.generated.prefix="" pdf.generated.path="target"
		pdf.generated.extension=".pdf" pdf.generated.charset="UTF-8"
		pdf.template.charset="UTF-8" />
	<security keystore.type="JKS" keystore.pk.provider="SUN"
		keystore.pk.alias="fpdemo" keystore.filename="demo.keystore"
		keystore.password="footprint" keystore.pk.password="footprint"
		signature.location="Fortaleza Ce Brasil"
		signature.reason="Evento Cafe com Tapioca">
		<signature.stamp signature.stamp.image.filename="selo.gif"
			signature.stamp.x1="140" signature.stamp.y1="100" signature.stamp.x2="165"
			signature.stamp.y2="124" />
	</security>
	<database jdbc.query="SELECT name,title FROM test"
		jdbc.driver.classname="org.relique.jdbc.csv.CsvDriver"
		jdbc.connection.url="jdbc:relique:csv:./src/main/resources" >
		<driver.properties>
			<driver.properties value="," name="separator" />
			<driver.properties value="false" name="suppressHeaders" />
			<driver.properties value=".csv" name="fileExtension" />
			<driver.properties value="UTF-8" name="charset" />
		</driver.properties>
	</database>
	<pdf2jdbc>
		<mapping pdfField="name" databaseColumnName="name" />
		<mapping pdfField="jug" databaseColumnName="jug" />
	</pdf2jdbc>
	<email smtp.user="login@gmail.com" smtp.password="password"
		msg.from="login@gmail.com" smtp.transfer.protocol="smtp"
		smtp.star.ttls.enable="true" smtp.host="smtp.gmail.com"
		smtp.content.type="text/plain" smtp.auth="true" socks.proxy.port=""
		socks.proxy.host="" msg.subject="test" post.processing.type="MOVE">
		<msg.body>
			<![CDATA[
Dear JUG member,

you are receiving the digital certificate of your presence in the Footprint Demo Event.

Thank you very much for your participation in this great JUG community moment,

    Felipe GaÃºcho
    CEJUG Coordinator
___________
This certificate was generated by The Footprint Project (footprint.dev.java.net), a library developed to help JUGs to publish
certificates for its events. Please be our guest to reuse this new tool in your local community, and feel free to send your
feedback to fgaucho@gmail.com
			]]>
		</msg.body>
	</email>
</configuration>
